{"v":"hwcf-1","kind":"hwcf_step_rows","profile":"part","workflow":"1743507592","d":{"t":["SINGLE_CONNECTION"]},"sk":["id","n","t","next","branch","timing","asset","goal","f","hints","x"],"s":[["1",null,0,["4"],null,null,null,null,null,{"actionType":"SINGLE_CONNECTION"},{"actionTypeVersion":11,"actionTypeId":"0-172351286"}],["4",null,0,[],null,null,{"propertyName":"sales_qa_type_question"},null,52,{"actionType":"SINGLE_CONNECTION","updatesProperty":true},{"actionTypeVersion":0,"actionTypeId":"0-5"}]],"raw":{"sourceHash":"sha256:c0b1f7c3fbc1a6bce470748dcf77d46ef618f5a2560c99040fd50c34eeaebccd"}}
